Dimension,Item,item-sit
LS,In most ways my life is close to my ideal. ,How much does this experience indicate the speaker felt their life was close to their ideal?
LS,The conditions of my life are excellent.,How much does this experience indicate the speaker felt the conditions of their life were excellent?
LS,I am satisfied with my life.,How much does this experience indicate the speaker felt satisfied with their life?
LS,So far I have gotten the important things I want in life.,How much does this experience indicate the speaker felt they had gotten the important things they wanted in life?
LS,"If I could live my life over, I would change almost nothing.",How much does this experience indicate the speaker felt they would change almost nothing if they could live life over?
